<?xml version="1.0" encoding="iso-8859-1" ?>
<!DOCTYPE config SYSTEM "file:///opt/stechec/share/stechec/config.dtd">

<!--

C'est dans ce fichier que vous configurerez votre match.
Vous devez definir le nombre d'equipe (une equipe etant en fait
un champion), le nombre de tours a jouer, ainsi que la carte a
utiliser.

Ensuite, vous devez definir autant de clients que d'equipe.
Dans ce fichier, nous avons configure 5 equipes, et on retrouve
effectivement 5 sections <client id="n"> ... </client>.

L'interface graphique est aussi un client, mais n'est pas compte
comme une equipe. Si vous souhaitez la desactiver, pour faire par
exemple une grande serie de matchs, il vous suffit de supprimer
ou de commenter la section correspondante (ici, celle d'id 6).
Il est important de modifier nb_spectator dans la section server.

N'hesitez pas a poser vos questions sur le forum de Prologin.

!-->

<config>

  <game>
    <nb_team>5</nb_team>      <!-- Nombre de champions sur la map                       !-->
    <max_turn>400</max_turn>  <!-- Nombre de tours a jouer                              !-->
    <map>arena10.map</map>    <!-- Map dispos dans /opt/stechec/share/stechec/prolo2007 !-->
  </game>

  <client>
    <rules>globulus</rules>
    <connect val="network" host="127.0.0.1" port="25150"
             game_uid="40" connect_on_startup="true" />
  </client>

<!--
Ici, vous devez definir le chemin vers votre champion, qui est
le fichier .so genere par le Makefile.
En tournoi, vous aurez cinq instances de votre champion par map,
soit en tout 10 champions sur la carte.
Note : il ne faut *pas* mettre le .so a la fin. L'extension varie d'un
       systeme a l'autre, notre programme la determine donc tout seul.
!-->
  <client id="1">
    <champion>/opt/stechec/champions/champion</champion>
    <mode replay="false" spectator="false" />
    <limit memory="10000" time="500" time_reserve="2500" />
    <debug valgrind="false" gdb="false" verbose="3" printloc="true" />
  </client>

  <client id="2">
    <champion>/opt/stechec/champions/champion</champion>
    <mode replay="false" spectator="false" />
    <limit memory="10000" time="500" time_reserve="2500" />
    <debug valgrind="false" gdb="false" verbose="3" printloc="true" />
  </client>

  <client id="3">
    <champion>/opt/stechec/champions/champion</champion>
    <mode replay="false" spectator="false" />
    <limit memory="10000" time="500" time_reserve="2500" />
    <debug valgrind="false" gdb="false" verbose="3" printloc="true" />
  </client>

  <client id="4">
    <champion>/opt/stechec/champions/champion</champion>
    <mode replay="false" spectator="false" />
    <limit memory="10000" time="500" time_reserve="2500" />
    <debug valgrind="false" gdb="false" verbose="3" printloc="true" />
  </client>

  <client id="5">
    <champion>/opt/stechec/champions/champion</champion>
    <mode replay="false" spectator="false" />
    <limit memory="10000" time="500" time_reserve="2500" />
    <debug valgrind="false" gdb="false" verbose="3" printloc="true" />
  </client>

<!--
Ce client est l'interface graphique. Pour la desactiver, il suffit
de supprimer l'entree, et de changer la valeur de nb_spectators
dans la section "server", un peu plus bas.
!-->
<!--  <client id="6">
    <champion>globulus_sdlvisu</champion>
    <mode replay="false" file="match.log" spectator="true" />
    <limit memory="0" time="500" time_reserve="2500" />
    <debug valgrind="false" gdb="false" verbose="3" printloc="true" />
    <screen res_x="800" res_y="600" />
  </client>
!-->
  <server>
    <rules>globulus</rules>
    <options persistent="false" start_game_timeout="30" />
    <listen port="25150" />
    <log enabled="false" file="match.log" />
    <nb_spectator>0</nb_spectator>
    <debug verbose="8" printloc="true" />
    <server_debug verbose="3" printloc="false" />
  </server>

</config>
