<?xml version="1.0" encoding="iso-8859-1" ?>
<!DOCTYPE config SYSTEM "file:///home/ghalaax/stechec/trunk/install/share/stechec/config.dtd">

<config>

  <game>
    <nb_team>3</nb_team>
    <max_turn>30</max_turn>
    <map>simple.map</map>
  </game>

  <client>
    <rules>globulus</rules>
    <connect val="network" host="127.0.0.1" port="25150"
             game_uid="40" connect_on_startup="true" />
  </client>

  <client id="666">
    <champion>/home/ghalaax/stechec/trunk/install/interfaces/c/champion</champion>
    <mode replay="false" spectator="false" />
    <limit memory="100000" time="500" time_reserve="2500" />
    <debug valgrind="false" gdb="false" verbose="8" printloc="true" />
  </client>

  <client id="665">
    <champion>/home/ghalaax/stechec/trunk/install/interfaces/c/champion</champion>
    <mode replay="false" spectator="false" />
    <limit memory="100000" time="500" time_reserve="2500" />
    <debug valgrind="false" gdb="false" verbose="8" printloc="true" />
  </client>

  <server>
    <rules>globulus</rules>
    <options persistent="true" start_game_timeout="30" />
    <listen port="25150" />
    <log enabled="false" file="match.log" />
    <nb_spectator>0</nb_spectator>
    <debug verbose="8" printloc="true" />
    <server_debug verbose="3" printloc="false" />
  </server>

</config>
